<?xml version="1.0" encoding="UTF-8"?>
<!DOCTYPE root SYSTEM "log.dtd">
<root>
    <style>
        <rel>stylesheet</rel>
        <href>style.css</href>
    </style>
    <date>
        <user>111</user>
        <pass>222</pass>
       
        
    </date>
    
<date><user>111</user><pass>222</pass></date><date><user>111</user><pass>222</pass></date><date><user>111</user><pass>222</pass></date><date><user>111</user><pass>222</pass></date></root>
